{
  "generated": "2026-04-27T07:09:51.179302+00:00",
  "target": "/mnt/windows",
  "hive": "/mnt/windows/Windows/System32/config/SYSTEM",
  "summary": {
    "verdict": "SUSPICIOUS",
    "total": 441,
    "suspicious_count": 3,
    "third_party_count": 0,
    "deleted_count": 113,
    "auto_start_services": 75
  },
  "services": [
    {
      "name": ".NET CLR Data",
      "display_name": ".NET CLR Data",
      "start": "?",
      "type": "?",
      "image_path": "",
      "resolved_path": "",
      "path_exists": null,
      "object_name": "",
      "flags": [],
      "suspicious_reason": null
    },
    {
      "name": ".NET CLR Networking",
      "display_name": ".NET CLR Networking",
      "start": "?",
      "type": "?",
      "image_path": "",
      "resolved_path": "",
      "path_exists": null,
      "object_name": "",
      "flags": [],
      "suspicious_reason": null
    },
    {
      "name": ".NET CLR Networking 4.0.0.0",
      "display_name": ".NET CLR Networking 4.0.0.0",
      "start": "?",
      "type": "?",
      "image_path": "",
      "resolved_path": "",
      "path_exists": null,
      "object_name": "",
      "flags": [],
      "suspicious_reason": null
    },
    {
      "name": ".NET Data Provider for Oracle",
      "display_name": ".NET Data Provider for Oracle",
      "start": "?",
      "type": "?",
      "image_path": "",
      "resolved_path": "",
      "path_exists": null,
      "object_name": "",
      "flags": [],
      "suspicious_reason": null
    },
    {
      "name": ".NET Data Provider for SqlServer",
      "display_name": ".NET Data Provider for SqlServer",
      "start": "?",
      "type": "?",
      "image_path": "",
      "resolved_path": "",
      "path_exists": null,
      "object_name": "",
      "flags": [],
      "suspicious_reason": null
    },
    {
      "name": ".NETFramework",
      "display_name": ".NETFramework",
      "start": "?",
      "type": "?",
      "image_path": "",
      "resolved_path": "",
      "path_exists": null,
      "object_name": "",
      "flags": [],
      "suspicious_reason": null
    },
    {
      "name": "ACPI",
      "display_name": "Microsoft ACPI Driver",
      "start": "BOOT",
      "type": "KERNEL_DRIVER",
      "image_path": "system32\\drivers\\acpi.sys",
      "resolved_path": "system32\\drivers\\acpi.sys",
      "path_exists": null,
      "object_name": "",
      "flags": [
        "DRIVER"
      ],
      "suspicious_reason": null
    },
    {
      "name": "AdobeARMservice",
      "display_name": "Adobe Acrobat Update Service",
      "start": "AUTO",
      "type": "OWN_PROCESS",
      "image_path": "\"C:\\Program Files\\Common Files\\Adobe\\ARM\\1.0\\armsvc.exe\"",
      "resolved_path": "C:\\Program Files\\Common Files\\Adobe\\ARM\\1.0\\armsvc.exe",
      "path_exists": true,
      "object_name": "LocalSystem",
      "flags": [],
      "suspicious_reason": null
    },
    {
      "name": "adp94xx",
      "display_name": "adp94xx",
      "start": "DISABLED",
      "type": "KERNEL_DRIVER",
      "image_path": "\\SystemRoot\\system32\\drivers\\adp94xx.sys",
      "resolved_path": "\\SystemRoot\\system32\\drivers\\adp94xx.sys",
      "path_exists": false,
      "object_name": "",
      "flags": [
        "DRIVER",
        "DISABLED",
        "DELETED"
      ],
      "suspicious_reason": null
    },
    {
      "name": "adpahci",
      "display_name": "adpahci",
      "start": "DISABLED",
      "type": "KERNEL_DRIVER",
      "image_path": "\\SystemRoot\\system32\\drivers\\adpahci.sys",
      "resolved_path": "\\SystemRoot\\system32\\drivers\\adpahci.sys",
      "path_exists": false,
      "object_name": "",
      "flags": [
        "DRIVER",
        "DISABLED",
        "DELETED"
      ],
      "suspicious_reason": null
    },
    {
      "name": "adpu160m",
      "display_name": "adpu160m",
      "start": "DISABLED",
      "type": "KERNEL_DRIVER",
      "image_path": "\\SystemRoot\\system32\\drivers\\adpu160m.sys",
      "resolved_path": "\\SystemRoot\\system32\\drivers\\adpu160m.sys",
      "path_exists": false,
      "object_name": "",
      "flags": [
        "DRIVER",
        "DISABLED",
        "DELETED"
      ],
      "suspicious_reason": null
    },
    {
      "name": "adpu320",
      "display_name": "adpu320",
      "start": "DISABLED",
      "type": "KERNEL_DRIVER",
      "image_path": "\\SystemRoot\\system32\\drivers\\adpu320.sys",
      "resolved_path": "\\SystemRoot\\system32\\drivers\\adpu320.sys",
      "path_exists": false,
      "object_name": "",
      "flags": [
        "DRIVER",
        "DISABLED",
        "DELETED"
      ],
      "suspicious_reason": null
    },
    {
      "name": "adsi",
      "display_name": "adsi",
      "start": "?",
      "type": "?",
      "image_path": "",
      "resolved_path": "",
      "path_exists": null,
      "object_name": "",
      "flags": [],
      "suspicious_reason": null
    },
    {
      "name": "AeLookupSvc",
      "display_name": "@%SystemRoot%\\system32\\aelupsvc.dll,-1",
      "start": "AUTO",
      "type": "SHARE_PROCESS",
      "image_path": "%systemroot%\\system32\\svchost.exe -k netsvcs",
      "resolved_path": "%systemroot%\\system32\\svchost.exe",
      "path_exists": null,
      "object_name": "localSystem",
      "flags": [],
      "suspicious_reason": null
    },
    {
      "name": "AFD",
      "display_name": "Ancilliary Function Driver for Winsock",
      "start": "SYSTEM",
      "type": "KERNEL_DRIVER",
      "image_path": "\\SystemRoot\\system32\\drivers\\afd.sys",
      "resolved_path": "\\SystemRoot\\system32\\drivers\\afd.sys",
      "path_exists": false,
      "object_name": "",
      "flags": [
        "DRIVER",
        "DELETED"
      ],
      "suspicious_reason": null
    },
    {
      "name": "AgereModemAudio",
      "display_name": "Agere Modem Call Progress Audio",
      "start": "AUTO",
      "type": "OWN_PROCESS",
      "image_path": "C:\\Windows\\system32\\agrsmsvc.exe",
      "resolved_path": "C:\\Windows\\system32\\agrsmsvc.exe",
      "path_exists": false,
      "object_name": "LocalSystem",
      "flags": [
        "DELETED"
      ],
      "suspicious_reason": null
    },
    {
      "name": "AgereSoftModem",
      "display_name": "Agere Systems Soft Modem",
      "start": "DEMAND",
      "type": "KERNEL_DRIVER",
      "image_path": "system32\\DRIVERS\\AGRSM.sys",
      "resolved_path": "system32\\DRIVERS\\AGRSM.sys",
      "path_exists": null,
      "object_name": "",
      "flags": [
        "DRIVER"
      ],
      "suspicious_reason": null
    },
    {
      "name": "agp440",
      "display_name": "Intel AGP Bus Filter",
      "start": "DEMAND",
      "type": "KERNEL_DRIVER",
      "image_path": "\\SystemRoot\\system32\\drivers\\agp440.sys",
      "resolved_path": "\\SystemRoot\\system32\\drivers\\agp440.sys",
      "path_exists": false,
      "object_name": "",
      "flags": [
        "DRIVER",
        "DELETED"
      ],
      "suspicious_reason": null
    },
    {
      "name": "aic78xx",
      "display_name": "aic78xx",
      "start": "DISABLED",
      "type": "KERNEL_DRIVER",
      "image_path": "\\SystemRoot\\system32\\drivers\\djsvs.sys",
      "resolved_path": "\\SystemRoot\\system32\\drivers\\djsvs.sys",
      "path_exists": false,
      "object_name": "",
      "flags": [
        "DRIVER",
        "DISABLED",
        "DELETED"
      ],
      "suspicious_reason": null
    },
    {
      "name": "ALG",
      "display_name": "@%SystemRoot%\\system32\\Alg.exe,-112",
      "start": "DEMAND",
      "type": "OWN_PROCESS",
      "image_path": "%SystemRoot%\\System32\\alg.exe",
      "resolved_path": "%SystemRoot%\\System32\\alg.exe",
      "path_exists": null,
      "object_name": "NT AUTHORITY\\LocalService",
      "flags": [],
      "suspicious_reason": null
    },
    {
      "name": "aliide",
      "display_name": "aliide",
      "start": "DISABLED",
      "type": "KERNEL_DRIVER",
      "image_path": "\\SystemRoot\\system32\\drivers\\aliide.sys",
      "resolved_path": "\\SystemRoot\\system32\\drivers\\aliide.sys",
      "path_exists": false,
      "object_name": "",
      "flags": [
        "DRIVER",
        "DISABLED",
        "DELETED"
      ],
      "suspicious_reason": null
    },
    {
      "name": "amdagp",
      "display_name": "AMD AGP Bus Filter Driver",
      "start": "DEMAND",
      "type": "KERNEL_DRIVER",
      "image_path": "\\SystemRoot\\system32\\drivers\\amdagp.sys",
      "resolved_path": "\\SystemRoot\\system32\\drivers\\amdagp.sys",
      "path_exists": false,
      "object_name": "",
      "flags": [
        "DRIVER",
        "DELETED"
      ],
      "suspicious_reason": null
    },
    {
      "name": "amdide",
      "display_name": "amdide",
      "start": "DISABLED",
      "type": "KERNEL_DRIVER",
      "image_path": "\\SystemRoot\\system32\\drivers\\amdide.sys",
      "resolved_path": "\\SystemRoot\\system32\\drivers\\amdide.sys",
      "path_exists": false,
      "object_name": "",
      "flags": [
        "DRIVER",
        "DISABLED",
        "DELETED"
      ],
      "suspicious_reason": null
    },
    {
      "name": "AmdK7",
      "display_name": "AMD K7 Processor Driver",
      "start": "DISABLED",
      "type": "KERNEL_DRIVER",
      "image_path": "\\SystemRoot\\system32\\drivers\\amdk7.sys",
      "resolved_path": "\\SystemRoot\\system32\\drivers\\amdk7.sys",
      "path_exists": false,
      "object_name": "",
      "flags": [
        "DRIVER",
        "DISABLED",
        "DELETED"
      ],
      "suspicious_reason": null
    },
    {
      "name": "AmdK8",
      "display_name": "AMD K8 Processor Driver",
      "start": "DISABLED",
      "type": "KERNEL_DRIVER",
      "image_path": "\\SystemRoot\\system32\\drivers\\amdk8.sys",
      "resolved_path": "\\SystemRoot\\system32\\drivers\\amdk8.sys",
      "path_exists": false,
      "object_name": "",
      "flags": [
        "DRIVER",
        "DISABLED",
        "DELETED"
      ],
      "suspicious_reason": null
    },
    {